{
  "$schema": "https://json-schema.org/draft/2020-12/schema",
  "$id": "https://socioprophet.github.io/sociosphere/protocol/workspace-fabric/v0/mount-registration-request.schema.json",
  "title": "MountRegistrationRequest",
  "type": "object",
  "additionalProperties": false,
  "required": [
    "api_version",
    "kind",
    "workspace",
    "mount",
    "datasets",
    "adapters",
    "policy",
    "lease_request"
  ],
  "properties": {
    "api_version": {"const": "sourceos.fabric.mount/v0.1"},
    "kind": {"const": "MountRegistrationRequest"},
    "workspace": {
      "type": "object",
      "additionalProperties": false,
      "required": ["cell", "id", "principal"],
      "properties": {
        "cell": {"type": "string", "minLength": 1},
        "id": {"type": "string", "minLength": 1},
        "principal": {"type": "string", "minLength": 1}
      }
    },
    "mount": {
      "type": "object",
      "additionalProperties": false,
      "required": [
        "id",
        "backend",
        "resolved_handle",
        "authority_mode",
        "durability_class",
        "replay_mode",
        "visibility_default"
      ],
      "properties": {
        "id": {"type": "string", "minLength": 1},
        "backend": {"type": "string", "minLength": 1},
        "resolved_handle": {"type": "string", "minLength": 1},
        "authority_mode": {"enum": ["local_first", "provider_first", "hybrid"]},
        "durability_class": {"type": "string", "minLength": 1},
        "replay_mode": {"type": "string", "minLength": 1},
        "visibility_default": {"type": "string", "minLength": 1}
      }
    },
    "datasets": {
      "type": "array",
      "minItems": 1,
      "items": {
        "type": "object",
        "additionalProperties": false,
        "required": ["id", "role", "indexes"],
        "properties": {
          "id": {"type": "string", "minLength": 1},
          "role": {"type": "string", "minLength": 1},
          "indexes": {
            "type": "array",
            "minItems": 1,
            "items": {
              "type": "object",
              "additionalProperties": false,
              "required": ["id", "engine", "mode"],
              "properties": {
                "id": {"type": "string", "minLength": 1},
                "engine": {"type": "string", "minLength": 1},
                "mode": {
                  "enum": [
                    "authoritative_local",
                    "authoritative_remote",
                    "derived_cache",
                    "ephemeral"
                  ]
                }
              }
            }
          }
        }
      }
    },
    "adapters": {
      "type": "array",
      "items": {
        "type": "object",
        "additionalProperties": false,
        "required": ["kind", "role"],
        "properties": {
          "kind": {"type": "string", "minLength": 1},
          "role": {
            "enum": [
              "topic_distribution",
              "object_snapshot_replica",
              "compatibility_mirror",
              "bulk_sync",
              "collaboration_ingress",
              "cold_archive"
            ]
          },
          "topics": {"type": "array", "items": {"type": "string", "minLength": 1}},
          "bucket": {"type": "string"},
          "folder_id": {"type": "string"},
          "endpoint": {"type": "string"}
        }
      }
    },
    "policy": {
      "type": "object",
      "additionalProperties": false,
      "required": ["bundle", "quorum_profile", "require_signed_tombstones", "stale_mirror_policy"],
      "properties": {
        "bundle": {"type": "string", "minLength": 1},
        "quorum_profile": {"type": "string", "minLength": 1},
        "require_signed_tombstones": {"type": "boolean"},
        "stale_mirror_policy": {"type": "string", "minLength": 1}
      }
    },
    "lease_request": {
      "type": "object",
      "additionalProperties": false,
      "required": ["ttl", "renewable"],
      "properties": {
        "ttl": {"type": "string", "minLength": 1},
        "renewable": {"type": "boolean"}
      }
    }
  }
}
